{
  "incident_id": "INC-001",
  "service": "autotops-demo",
  "namespace": "default",
  "failure_type": "CrashLoopBackOff",
  "severity": "HIGH",
  "detected_at": "2026-10-07T21:16:17Z",
  "status": "OPEN",
  "source": {
    "watcher": "watcher-v0"
  },
  "evidence": {
    "pod_status": {
      "name": "autotops-demo-75778b7547-dzx8b",
      "phase": "Running",
      "containers": [
        {
          "name": "autotops-demo",
          "ready": false,
          "restart_count": 5,
          "waiting_reason": "CrashLoopBackOff",
          "last_terminated_reason": "Error",
          "last_exit_code": 1
        }
      ]
    },
    "kubernetes_events": [
      {
        "type": "Warning",
        "reason": "BackOff",
        "message": "Back-off restarting failed container autotops-demo in pod autotops-demo-75778b7547-dzx8b_default(f9904741-7fd0-4a3e-94d5-6cc9a572e7be)",
        "count": 10
      },
      {
        "type": "Normal",
        "reason": "Pulled",
        "message": "Container image \"autotops-demo:0.2\" already present on machine and can be accessed by the pod",
        "count": 6
      },
      {
        "type": "Normal",
        "reason": "Created",
        "message": "Container created",
        "count": 6
      },
      {
        "type": "Normal",
        "reason": "Started",
        "message": "Container started",
        "count": 6
      }
    ],
    "metrics": {
      "restart_count": 5
    },
    "logs": [
      " * Serving Flask app 'app'",
      " * Debug mode: off",
      "WARNING: This is a development server. Do not use it in a production deployment. Use a production WSGI server instead.",
      " * Running on all addresses (0.0.0.0)",
      " * Running on http://127.0.0.1:5000",
      " * Running on http://10.244.0.7:5000",
      "Press CTRL+C to quit"
    ]
  }
}